{
  "artifact_family": "local_evidence_record",
  "schema_version": "1.0.0",
  "policy_version": "phase1-gate-v1",
  "ruleset_version": "local-evidence-fallback-v1",
  "evidence_id": "ev_eeeeeeeeeeeeeeee",
  "created_at": "2026-04-30T00:00:00.000000Z",
  "trace_id": "tr_phase1_example",
  "run_id": "run_phase1_example",
  "stage": "verifier",
  "summary": "Example local fallback evidence record.",
  "artifact_refs": [
    {
      "path": "runtime_engine/verifier.py",
      "digest": "sha256:example-artifact-digest"
    }
  ],
  "verifier_decision_ref": "runtime/examples/verifier-decision.example.json",
  "completion_ref": null,
  "writeback_status": "fallback_local",
  "local_fallback": true,
  "canonical_truth": false
}
